{
  "schema_version": "0.1.0",
  "algorithm_id": "MVX-GROUP-STRATIFIED-HMAC-2",
  "algorithm_version": "2.0.0",
  "implementation_sha256": "dddddddddddddddddddddddddddddddddddddddddddddddddddddddddddddddd",
  "protocol_root_sha256": "aaaaaaaaaaaaaaaaaaaaaaaaaaaaaaaaaaaaaaaaaaaaaaaaaaaaaaaaaaaaaaaa",
  "freeze_id": "mvx-g1-0123456789abcdef0123456789abcdef",
  "precommit_sha256": "1212121212121212121212121212121212121212121212121212121212121212",
  "publication_receipt_sha256": "abababababababababababababababababababababababababababababababab",
  "selection_seed_sha256": "1313131313131313131313131313131313131313131313131313131313131313",
  "salt_sha256": "bbbbbbbbbbbbbbbbbbbbbbbbbbbbbbbbbbbbbbbbbbbbbbbbbbbbbbbbbbbbbbbb",
  "input_records_sha256": "cccccccccccccccccccccccccccccccccccccccccccccccccccccccccccccccc",
  "assignments": [
    {"lineage_id": "LIN-DEV", "leakage_group_id": "GRP-DEV", "split": "development", "selection_stratum": "objaverse", "blind_scope": "NONE", "creator_group": "CREATOR-DEV", "source_uid": "UID-DEV"},
    {"lineage_id": "LIN-BLIND", "leakage_group_id": "GRP-BLIND", "split": "blind", "selection_stratum": "objaverse", "blind_scope": "IID", "creator_group": "CREATOR-BLIND", "source_uid": "UID-BLIND"}
  ],
  "counts": {"development": 1, "calibration": 0, "blind": 1, "reserve": 0},
  "deviations": []
}
